source_concept_id,source_term,target_concept_id,target_concept_name,predicate,target_concept_id_b,target_concept_name_b,predicate_b,cleaned_term,mapped_concept_id,mapped_concept_name
1572809,Injury of branches of celiac and mesenteric artery,37167847,Injury of blood vessel of abdomen,broadMatch,,,,Injury of branches of celiac and mesenteric artery,-1,
1572934,Unspecified fracture of upper end of humerus,4133610,Fracture of upper end of humerus,exactMatch,,,,fracture of upper end of humerus,4133610,Fracture of upper end of humerus
1573395,Unspecified fracture of navicular [scaphoid] bone of wrist,4137945,Fracture of scaphoid bone of wrist,exactMatch,,,,fracture of navicular [scaphoid] bone of wrist,-1,
1573900,Injury of peroneal nerve at lower leg level,4106172,Traumatic injury of common peroneal nerve,exactMatch,,,,Injury of peroneal nerve at lower leg level,-1,
1574091,Fracture of unspecified tarsal bone(s),4134336,Fracture of tarsal bone,exactMatch,,,,Fracture of tarsal bone,4134336,Fracture of tarsal bone
1574259,Foreign body in other parts of respiratory tract,4094822,Foreign body in respiratory tract,exactMatch,,,,Foreign body in respiratory tract,4094822,Foreign body in respiratory tract
1574368,Burn of unspecified degree of wrist and hand,3657564,Burn of wrist and hand,exactMatch,,,,Burn of wrist and hand,3657564,Burn of wrist and hand
1574545,Corrosion of cornea and conjunctival sac,4335977,Injury of cornea,broadMatch,,,,Corrosion of cornea and conjunctival sac,-1,
1575178,Infection due to central venous catheter,42537043,CLABSI - central line associated bloodstream infection,broadMatch,,,,Infection due to central venous catheter,-1,
1575278,Infection and inflammatory reaction due to internal joint prosthesis,4308690,Prosthetic joint infection,broadMatch,,,,Infection and inflammatory reaction due to internal joint prosthesis,-1,
1575861,Military operations involving other firearms discharge,439446,Assault by military firearm,broadMatch,,,,firearms discharge,-1,
1575911,Obstetric and gynecological devices associated with adverse incidents,43021248,Complication associated with genitourinary device,broadMatch,,,,Obstetric and gynecological devices associated with adverse incidents,-1,
1575914,Orthopedic devices associated with adverse incidents,43021250,Complication associated with orthopedic device,exactMatch,,,,Orthopedic devices associated with adverse incidents,-1,
1576184,Contact with and (suspected) exposure to hazards in the physical environment,37016166,Exposure to potentially hazardous substance,broadMatch,,,,Contact with and (suspected) exposure to hazards in the physical environment,-1,
1576270,Insect allergy status,3661864,Allergic reaction caused by insect bite and/or insect sting,broadMatch,,,,Insect allergy status,-1,
1595653,"Infection of obstetric surgical wound, superficial incisional site",37208108,Infection of superficial obstetric surgical wound,exactMatch,,,,"Infection of obstetric surgical wound, superficial incisional site",-1,
21013352,Encephalopathy in endocrine and metabolic disorders classified elsewhere (machine translation),372892,Metabolic encephalopathy,exactMatch,,,,Encephalopathy in endocrine and metabolic disorders classified elsewhere (machine translation),-1,
35104073,Subacute combined cord degeneration,140099,Subacute combined degeneration of spinal cord,exactMatch,,,,Subacute combined cord degeneration,-1,
35104255,Polycythaemia vera,135214,Polycythemia vera (clinical),exactMatch,,,,Polycythaemia vera,4030270,Polycythemia vera
35124545,Small cell lymphocytic lymphoma,4119130,Malignant lymphoma - small lymphocytic,exactMatch,,,,Small cell lymphocytic lymphoma,-1,
35205597,Gonococcal pharyngitis,30333,Gonorrhea of pharynx,exactMatch,,,,Gonococcal pharyngitis,30333,Gonorrhea of pharynx
35205669,Urban rabies,377793,Rabies,broadMatch,,,,Urban rabies,-1,
35205691,Lymphocytic choriomeningitis,434860,Meningitis caused by lymphocytic choriomeningitis virus,exactMatch,,,,Lymphocytic choriomeningitis,434860,Meningitis caused by lymphocytic choriomeningitis virus
35205698,Dengue fever [classical dengue],440022,Dengue,exactMatch,,,,Dengue fever [classical dengue],-1,
35205805,Tinea barbae and tinea capitis,135473,Dermatophytosis,broadMatch,,,,Tinea barbae and tinea capitis,-1,
35205856,Cutaneous chromomycosis,4080755,Cutaneous chromoblastomycosis,broadMatch,,,,Cutaneous chromomycosis,-1,
35206544,Benign lipomatous neoplasm of intrathoracic organs,433167,Lipoma of intrathoracic organs,exactMatch,,,,Benign lipomatous neoplasm of intrathoracic organs,-1,
35206545,Benign lipomatous neoplasm of intra-abdominal organs,196654,Lipoma of intra-abdominal organs,exactMatch,,,,Benign lipomatous neoplasm of intra-abdominal organs,-1,
35206716,"Anemia due to enzyme disorder, unspecified",444238,Anemia due to enzyme deficiency,exactMatch,601114.0,Anemia due to enzymopathy,exactMatch,Anemia due to enzyme disorder,601114,Anemia due to enzymopathy
35206744,Drug-induced aplastic anemia,4146088,Aplastic anemia due to drugs,exactMatch,,,,Drug-induced aplastic anemia,4146088,Aplastic anemia due to drugs
35207115,Amnestic disorder due to known physiological condition,36712678,Amnestic disorder associated with general medical condition,exactMatch,,,,Amnestic disorder due to known physiological condition,-1,
35207549,Other specified disorders of choroid,432620,Disorder of choroid of eye,exactMatch,,,,disorders of choroid,-1,
35207645,Rheumatic mitral stenosis with insufficiency,4301373,Rheumatic mitral stenosis with regurgitation,exactMatch,,,,Rheumatic mitral stenosis with insufficiency,4301373,Rheumatic mitral stenosis with regurgitation
35207682,Other forms of angina pectoris,321318,Angina pectoris,exactMatch,,,,angina pectoris,38001139,Angina pectoris
35207700,Other forms of acute ischemic heart disease,319844,Acute ischemic heart disease,exactMatch,,,,acute ischemic heart disease,319844,Acute ischemic heart disease
35208218,"Duodenal ulcer, unspecified as acute or chronic, without hemorrhage or perforation",4198381,Ulcer of duodenum,exactMatch,4209746.0,Duodenal ulcer without hemorrhage AND without perforation,exactMatch,Duodenal ulcer without hemorrhage or perforation,-1,
35208415,Other specified diseases of the digestive system,4201745,Disorder of digestive system,exactMatch,,,,diseases of the digestive system,-1,
35208494,"Anogenital pruritus, unspecified",36685964,Pruritis of skin of anogenital region,exactMatch,,,,Anogenital pruritus,36685964,Pruritis of skin of anogenital region
35208562,Drug photoallergic response,4286349,Drug-induced photosensitivity,exactMatch,4009034.0,Photoallergic dermatitis,exactMatch,Drug photoallergic response,-1,
35209145,Acquired deformity of chest and rib,40487194,Acquired deformity of chest wall,exactMatch,,,,Acquired deformity of chest and rib,-1,
35209278,"Chronic kidney disease, stage 5",443611,Chronic kidney disease stage 5,exactMatch,,,,"Chronic kidney disease, stage 5",443611,Chronic kidney disease stage 5
35209296,"Small kidney, unspecified",195861,Small kidney,exactMatch,,,,Small kidney,195861,Small kidney
35209386,Subacute and chronic vulvitis,4173450,Chronic vulvitis,broadMatch,4173450.0,Chronic vulvitis,broadMatch,Subacute and chronic vulvitis,-1,
35209457,"Noninflammatory disorder of vagina, unspecified",195867,Noninflammatory disorder of the vagina,exactMatch,,,,Noninflammatory disorder of vagina,-1,
35210412,Newborn affected by other maternal complications of pregnancy,37167889,Early neonatal disorder due to maternal disorder during pregnancy,exactMatch,,,,Newborn affected by maternal complications of pregnancy,-1,
35210484,Respiratory distress syndrome of newborn,258866,Respiratory distress syndrome in the newborn,exactMatch,,,,Respiratory distress syndrome of newborn,258866,Respiratory distress syndrome in the newborn
35210614,"Transitory disorder of carbohydrate metabolism of newborn, unspecified",441406,Disorder of fetus and/or newborn,broadMatch,,,,Transitory disorder of carbohydrate metabolism of newborn,-1,
35210756,"Congenital malformation of anterior segment of eye, unspecified",436805,Congenital anomaly of anterior segment of eye,exactMatch,,,,Congenital malformation of anterior segment of eye,-1,
35210962,Other congenital malformations of liver,444421,Congenital anomaly of liver,exactMatch,,,,congenital malformations of liver,444421,Congenital anomaly of liver
35211161,Ectodermal dysplasia (anhidrotic),134757,Ectodermal dysplasia,broadMatch,,,,Ectodermal dysplasia (anhidrotic),-1,
35225305,Family history of malignant neoplasm of digestive organs,4334494,Family history of malignant neoplasm of digestive organ,exactMatch,,,,Family history of malignant neoplasm of digestive organs,4334494,Family history of malignant neoplasm of digestive organ
35226391,AV block first degree,314379,First degree atrioventricular block,exactMatch,,,,AV block first degree,-1,
35305794,Galactosaemia,439788,Galactosemia,exactMatch,,,,Galactosaemia,439788,Galactosemia
35305997,Congenital joint malformation,4316226,Congenital anomaly of joint,exactMatch,,,,Congenital joint malformation,4316226,Congenital anomaly of joint
35306057,Hepato-lenticular degeneration,4229262,Wilson's disease,exactMatch,,,,Hepato-lenticular degeneration,-1,
35506549,Myopathy endocrine,442342,Endocrine myopathy,exactMatch,,,,Myopathy endocrine,-1,
35607013,Optic ischaemic neuropathy,373487,Ischemic optic neuropathy,exactMatch,,,,Optic ischaemic neuropathy,-1,
35607283,Miller Fisher syndrome,4070552,Fisher's syndrome,exactMatch,,,,Miller Fisher syndrome,4070552,Fisher's syndrome
35634774,Squint,4329707,Strabismus,exactMatch,,,,Squint,4329707,Strabismus
35707597,Gastric cyst,37109182,Cyst of stomach,exactMatch,,,,Gastric cyst,37109182,Cyst of stomach
35708029,Peritoneal infection,443796,Infectious peritonitis,exactMatch,,,,Peritoneal infection,-1,
35708587,Foot and mouth disease,4141481,Hand foot and mouth disease,exactMatch,,,,Foot and mouth disease,42574126,Foot and mouth disease
35738840,Partial small intestinal obstruction,4181798,Partial obstruction of small bowel,exactMatch,,,,Partial small intestinal obstruction,-1,
35739339,Colonic perforation,4177183,Perforation of colon,exactMatch,,,,Colonic perforation,4177183,Perforation of colon
35843794,Healing delayed,37312235,Delayed healing of wound,exactMatch,,,,Healing delayed,-1,
36045304,Systemic anaphylaxis,441202,Anaphylaxis,exactMatch,,,,Systemic anaphylaxis,441202,Anaphylaxis
36110511,Induced abortion infection,43530964,Induced termination of pregnancy complicated by infectious disease,exactMatch,,,,Induced abortion infection,-1,
36110888,Epstein-Barr virus infection,4345472,Epstein-Barr virus disease,exactMatch,,,,Epstein-Barr virus infection,-1,
36251346,Broken ankle,4059173,Fracture of ankle,exactMatch,,,,Broken ankle,-1,
36315364,Respiratory rate increased,317376,Tachypnea,exactMatch,,,,Respiratory rate increased,-1,
36569193,Effusion (l) knee,36684501,Effusion of joint of left knee,exactMatch,,,,Effusion (l) knee,-1,
36672513,Carcinoma uterine cervix in situ,194611,Carcinoma in situ of uterine cervix,exactMatch,,,,Carcinoma uterine cervix in situ,-1,
36774769,Progression of multiple sclerosis,37311816,Progressive multiple sclerosis,exactMatch,,,,Progression of multiple sclerosis,-1,
36774872,Migraine type headaches,318736,Migraine,exactMatch,,,,Migraine type headaches,-1,
36818761,Neonatal respiratory distress syndrome,258866,Respiratory distress syndrome in the newborn,exactMatch,,,,Neonatal respiratory distress syndrome,258866,Respiratory distress syndrome in the newborn
36919008,Poverty of thought content,4209458,Poverty of thought,exactMatch,,,,Poverty of thought content,-1,
36919045,Emotional disorder,4305081,Emotional problems,exactMatch,444100.0,Mood disorder,exactMatch,Emotional disorder,-1,
36919053,Affective disorder,444100,Mood disorder,exactMatch,,,,Affective disorder,444100,Mood disorder
36919162,"Schizophrenia, paranoid type",433450,Paranoid schizophrenia,exactMatch,,,,"Schizophrenia, paranoid type",-1,
37080642,Nephrotic syndrome with lesion of proliferative glomerulonephritis,197319,Nephrotic syndrome with proliferative glomerulonephritis,exactMatch,,,,Nephrotic syndrome with lesion of proliferative glomerulonephritis,-1,
37081344,"Acute nephritic syndrome, Other",4189531,Acute nephritis,exactMatch,4298809.0,Nephritic syndrome,broadMatch,Acute nephritic syndrome,4189531,Acute nephritis
37081600,Neoplasm of uncertain or unknown behaviour: Ovary,200675,Neoplasm of uncertain behavior of ovary,exactMatch,,,,Neoplasm of uncertain or unknown behaviour: Ovary,-1,
37081789,Other specified salmonella infections,133685,Salmonella infection,exactMatch,,,,salmonella infections,133685,Salmonella infection
37082072,"Malnutrition-related diabetes mellitus, with coma",4221933,Coma due to malnutrition-related diabetes mellitus,exactMatch,,,,"Malnutrition-related diabetes mellitus, with coma",-1,
37082094,Diabetes mellitus in connection with deficient nutrition or malnutritionwith multiple complications: Not described as derailed,37160913,Disorder due to malnutrition related diabetes mellitus,broadMatch,,,,"Diabetes mellitus due to malnutrition, with multiple complications",-1,
37082127,Other specified diabetes mellitus: With peripheral vascular complications: Not reported as derailed,321822,Peripheral vascular disorder due to diabetes mellitus,exactMatch,,,,diabetes mellitus with peripheral vascular complications,-1,
37082661,"Mental and behavioural disorders due to use of cannabinoids, withdrawal state with delirium",4220197,Cannabis intoxication delirium,exactMatch,4220197.0,Cannabis intoxication delirium,broadMatch,"Mental and behavioural disorders due to use of cannabinoids, withdrawal state with delirium",-1,
37082830,Specific (isolated) phobias,4182847,Simple phobia,exactMatch,,,,Specific (isolated) phobias,-1,
37083265,Parkinson disease,381270,Parkinson's disease,exactMatch,,,,Parkinson disease,381270,Parkinson's disease
37083340,Subacute combined degeneration of spinal cord in diseases classified elsewhere,140099,Subacute combined degeneration of spinal cord,exactMatch,,,,Subacute combined degeneration of spinal cord in diseases classified elsewhere,-1,
37083523,Nerve root and plexus compressions in other dorsopathies,43531045,Lesion of nerve root and/or plexus,broadMatch,,,,Nerve root and plexus compression,-1,
37084048,Glaucoma secondary to eye trauma,440396,Glaucoma due to ocular trauma,exactMatch,,,,Glaucoma secondary to eye trauma,-1,
37084578,Nonrheumatic tricuspid (valve) insufficiency,4111412,"Tricuspid incompetence, non-rheumatic",exactMatch,,,,Nonrheumatic tricuspid (valve) insufficiency,-1,
37084659,Atrial fibrillation: paroxysmal,4154290,Paroxysmal atrial fibrillation,exactMatch,,,,Atrial fibrillation: paroxysmal,-1,
37084767,"Cerebral aneurysm, nonruptured",4029497,Aneurysm of cerebral artery,exactMatch,,,,"Cerebral aneurysm, nonruptured",-1,
37084958,"Lymphoedema, not elsewhere classified",435839,Lymphedema,exactMatch,,,,Lymphoedema,4147210,Lymphatic edema
37085667,West Nile virus infection,438970,Disease caused by West Nile virus,exactMatch,,,,West Nile virus infection,438970,Disease caused by West Nile virus
37085900,Rubella without complication,4273323,Rubella,exactMatch,,,,Rubella,4273323,Rubella
37086807,"Chronic viral hepatitis, unspecified",4012113,Chronic viral hepatitis,exactMatch,,,,Chronic viral hepatitis,4012113,Chronic viral hepatitis
37087035,"Rheumatoid bursitis, other",134453,Bursitis,broadMatch,,,,Rheumatoid bursitis,-1,
37087206,"Juvenile ankylosing spondylitis, other",4083681,Juvenile ankylosing spondylitis,exactMatch,,,,Juvenile ankylosing spondylitis,4083681,Juvenile ankylosing spondylitis
37087421,"Familial chondrocalcinosis, forearm",4035750,Familial chondrocalcinosis,broadMatch,,,,"Familial chondrocalcinosis, forearm",-1,
37087581,"Gout arthropathy due to enzyme defects and other congenital diseases: hand [fingers, wrist, metacarpal, joints between these bones]",4035752,Gout secondary to enzyme defect,broadMatch,,,,"Gout arthropathy due to enzyme defects and congenital diseases, hand",-1,
37087754,Hallux valgus (acquired),75911,Acquired hallux valgus,exactMatch,,,,Hallux valgus (acquired),-1,
37088295,"Other idiopathic scoliosis, sacral and sacrococcygeal region",138841,Disorder of sacrum,broadMatch,,,,"idiopathic scoliosis, sacral and sacrococcygeal region",-1,
37088465,"Other specified deforming dorsopathies, thoracic region",4183247,Deformity of thoracic spine,exactMatch,,,,"deforming dorsopathies, thoracic region",-1,
37089004,"Myositis, unspecified",73001,Myositis,exactMatch,,,,Myositis,73001,Myositis
37089352,Spontaneous rupture of unspecified tendon,439907,Non-traumatic tendon rupture,exactMatch,,,,Spontaneous rupture of tendon,-1,
37089588,Plasmodium vivax malaria,433960,Vivax malaria,exactMatch,,,,Plasmodium vivax malaria,-1,
37089810,"Fibromyalgia, hand",40405599,Fibromyalgia,broadMatch,,,,"Fibromyalgia, hand",-1,
37089999,"Idiopathic osteoporosis, upper arm",81390,Idiopathic osteoporosis,broadMatch,,,,"Idiopathic osteoporosis, upper arm",-1,
37090164,"Adult osteomalacia, unspecified, upper arm",76191,Disorder of upper arm,broadMatch,,,,"Adult osteomalacia, upper arm",-1,
37090172,Disorders of continuity of bone,4344386,Disorder of continuity of bone,exactMatch,,,,Disorders of continuity of bone,4344386,Disorder of continuity of bone
37090672,Other specified disorders of bone,75909,Disorder of bone,exactMatch,,,,disorders of bone,75909,Disorder of bone
37090689,"Disorder of bone, unspecified, pelvic region and thigh",43531054,Disorder of pelvis,broadMatch,,,,"Disorder of bone, pelvic region and thigh",-1,
37090735,"Osteonecrosis in caisson disease, multiple sites",4069528,Osteonecrosis due to Caisson disease,exactMatch,45757800.0,Dysbaric osteonecrosis,exactMatch,"Osteonecrosis in caisson disease, multiple sites",-1,
37090758,"Osteonecrosis in other diseases classified elsewhere, multiple sites",4287786,Osteonecrosis,broadMatch,,,,"Osteonecrosis, multiple sites",-1,
37090828,"Osteochondrosis dissecans: pelvic region and thigh [pelvis, femur, buttocks, hips, hip joint, sacroiliac joint]",437359,Osteochondritis dissecans,broadMatch,,,,"Osteochondrosis dissecans: pelvic region and thigh [pelvis, femur, buttocks, hips, hip joint, sacroiliac joint]",-1,
37091304,"Disorder of prostate, unspecified",196734,Disorder of prostate,exactMatch,,,,Disorder of prostate,196734,Disorder of prostate
37091346,Disorders of prostate in diseases classified elsewhere,196734,Disorder of prostate,exactMatch,,,,Disorders of prostate in diseases classified elsewhere,-1,
37091592,Classical hydatidiform mole,4129710,Complete hydatidiform mole,exactMatch,,,,Classical hydatidiform mole,-1,
37091614,"Medical abortion, incomplete, complicated by embolism",37163809,Incomplete induced termination of pregnancy complicated by embolism,exactMatch,,,,"Medical abortion, incomplete, complicated by embolism",-1,
37091617,"Medical abortion, complete or unspecified, complicated by genital tract and pelvic infection",43530910,Induced termination of pregnancy complicated by genital-pelvic infection,exactMatch,,,,Medical abortion complicated by genital tract and pelvic infection,-1,
37091889,Other premature separation of placenta,198488,Placental abruption,exactMatch,,,,premature separation of placenta,198488,Placental abruption
37092117,Cerebral venous thrombosis in the puerperium,4066234,Cerebral venous thrombosis in puerperium,exactMatch,,,,Cerebral venous thrombosis in the puerperium,-1,
37092153,Malignant neoplasm: Overlapping lesion of floor of mouth,140955,Overlapping malignant neoplasm of floor of mouth,exactMatch,,,,Malignant neoplasm: Overlapping lesion of floor of mouth,140955,Overlapping malignant neoplasm of floor of mouth
37092544,Other neonatal aspiration syndromes,434154,Neonatal aspiration syndrome,exactMatch,,,,neonatal aspiration syndromes,434154,Neonatal aspiration syndrome
37093016,"Congenital malformation of cardiac septum, unspecified",4245646,Congenital septal defect of heart,exactMatch,,,,Congenital malformation of cardiac septum,-1,
37093223,"Congenital malformations of lips, not elsewhere classified",4033966,Congenital anomaly of lip,exactMatch,,,,Congenital malformations of lips,4033966,Congenital anomaly of lip
37093264,Other congenital malformations of intestine,4130372,Congenital anomaly of intestinal tract,exactMatch,,,,congenital malformations of intestine,-1,
37093308,Unicornate uterus,4028991,Uterus unicornis,exactMatch,,,,Unicornate uterus,4028991,Uterus unicornis
37094135,"Abnormal findings in cerebrospinal fluid, Abnormal histological findings",4172064,Abnormal histological findings in CSF,exactMatch,,,,"Abnormal findings in cerebrospinal fluid, Abnormal histological findings",-1,
37095180,Chronic erythremia,135214,Polycythemia vera (clinical),exactMatch,,,,Chronic erythremia,-1,
37095656,Sarcoma of dendritic cells (accessory cells),607994,Dendritic cell sarcoma,exactMatch,,,,Sarcoma of dendritic cells (accessory cells),-1,
37119729,Haematocoele female,200150,Female hematocele,exactMatch,,,,Haematocoele female,-1,
37200077,"Diabetes mellitus due to underlying condition with proliferative diabetic retinopathy without macular edema, bilateral",195771,Secondary diabetes mellitus,broadMatch,,,,"Diabetes mellitus due to underlying condition with proliferative diabetic retinopathy without macular edema, bilateral",-1,
37200082,"Diabetes mellitus due to underlying condition with diabetic macular edema, resolved following treatment, bilateral",195771,Secondary diabetes mellitus,broadMatch,,,,"Diabetes mellitus due to underlying condition with diabetic macular edema, resolved following treatment, bilateral",-1,
37200127,Drug or chemical induced diabetes mellitus with stable proliferative diabetic retinopathy,4202383,Drug-induced diabetes mellitus,broadMatch,,,,Drug or chemical induced diabetes mellitus with stable proliferative diabetic retinopathy,-1,
37200139,"Drug or chemical induced diabetes mellitus with diabetic macular edema, resolved following treatment, bilateral",380097,Macular edema due to diabetes mellitus,broadMatch,,,,"Drug or chemical induced diabetes mellitus with diabetic macular edema, resolved following treatment, bilateral",-1,
37200223,"Type 2 diabetes mellitus with proliferative diabetic retinopathy with macular edema, left eye",43530685,Proliferative retinopathy due to type 2 diabetes mellitus,broadMatch,,,,"Type 2 diabetes mellitus with proliferative diabetic retinopathy with macular edema, left eye",-1,
37200332,"Carpal tunnel syndrome, bilateral upper limbs",760925,Bilateral carpal tunnel syndrome,exactMatch,,,,"Carpal tunnel syndrome, bilateral upper limbs",-1,
37200967,"Mild to moderate pre-eclampsia, complicating childbirth",439393,Pre-eclampsia,broadMatch,,,,"Mild to moderate pre-eclampsia, complicating childbirth",-1,
37201112,"Other coma, without documented Glasgow coma scale score, or with partial score reported, 24 hours or more after hospital admission",380834,Coma,broadMatch,380834.0,Coma,exactMatch,coma,380834,Coma
37201411,"Fracture of other specified skull and facial bones, right side",4302223,Fracture of bone of head,broadMatch,,,,"Fracture of skull and facial bones, right side",-1,
37202299,Other specified procedure converted to open procedure,46272989,Failed procedure using minimal access approach converted to open procedure,exactMatch,,,,procedure converted to open procedure,-1,
37219908,Cough decreased,4199298,Decreased coughing,exactMatch,,,,Cough decreased,-1,
37223342,Other specified limb deformities - Multiple sites (machine translation),133857,Acquired deformity of limb,broadMatch,,,,"limb deformities, multiple sites",-1,
37223503,"Other specific joint derangements, not elsewhere classified, forearm",78228,Joint derangement,broadMatch,,,,"joint derangement, forearm",-1,
37223508,"Other specific joint derangements, not elsewhere classified, other",78228,Joint derangement,exactMatch,,,,joint derangements,78228,Joint derangement
37223683,"Juvenile idiopathic scoliosis, lumbosacral region",4067872,Adolescent idiopathic scoliosis,broadMatch,,,,"Juvenile idiopathic scoliosis, lumbosacral region",-1,
37223852,"Osteomyelitis of vertebra, lumbosacral region",195906,Disorder of lumbar spine,broadMatch,,,,"Osteomyelitis of vertebra, lumbosacral region",-1,
37223903,"Anterior spinal and vertebral artery compression syndromes, multiple sites in spine",4032003,Anterior spinal artery compression syndrome,broadMatch,,,,"Anterior spinal and vertebral artery compression syndromes, multiple sites in spine",-1,
37224058,"Enterobacterial spondylitis, site unspecified",4068478,Enterobacterial spondylitis,exactMatch,,,,Enterobacterial spondylitis,4068478,Enterobacterial spondylitis
37224088,"Collapsed vertebra in diseases classified elsewhere, site unspecified",4222001,Collapse of vertebra,exactMatch,,,,Collapsed vertebra,4222001,Collapse of vertebra
37224191,"Other dorsalgia, occipito-atlanto-axial region",4133638,Pain in cervical spine,broadMatch,,,,"dorsalgia, occipito-atlanto-axial region",-1,
37224682,"Necrotizing fasciitis, other",133566,Necrotizing fasciitis,exactMatch,,,,Necrotizing fasciitis,133566,Necrotizing fasciitis
37224781,"Enthesopathy, unspecified, upper arm",42537682,Enthesopathy of upper limb,exactMatch,,,,"Enthesopathy, upper arm",-1,
37224790,"Rheumatism, unspecified, forearm",136779,Disorder of forearm,broadMatch,,,,"Rheumatism, forearm",-1,
37224955,"Other osteoporosis with pathological fracture, other",40480160,Osteoporotic fracture,exactMatch,,,,osteoporosis with pathological fracture,-1,
37224965,"Unspecified osteoporosis with pathological fracture, other",40480160,Osteoporotic fracture,exactMatch,,,,osteoporosis with pathological fracture,-1,
37225260,"Osteitis condensans, hand",75920,Osteitis condensans,broadMatch,,,,"Osteitis condensans, hand",-1,
