source_concept_id,source_term,target_concept_id,target_concept_name,predicate,target_concept_id_b,target_concept_name_b,predicate_b,cleaned_term,mapped_concept_id,mapped_concept_name
42617680,"Spinal stenosis, lumbosacral region",4152592,Spinal stenosis of lumbosacral region,exactMatch,,,,"Spinal stenosis, lumbosacral region",-1,
42617855,"Sacrococcygeal disorders, not elsewhere classified, sacral and sacrococcygeal region",138841,Disorder of sacrum,broadMatch,,,,"Sacrococcygeal disorders, sacral and sacrococcygeal region",-1,
42617884,"Panniculitis affecting regions of neck and back, sacral and sacrococcygeal region",4273693,Panniculitis affecting sacrum,broadMatch,,,,"Panniculitis of neck, back, sacral and sacrococcygeal regions",-1,
42617901,"Other dorsalgia, thoracolumbar region",42596408,Thoracolumbar back pain,exactMatch,,,,"dorsalgia, thoracolumbar region",-1,
42618386,"Syphilitic bursitis, pelvic region and thigh",4001478,Syphilitic bursitis,broadMatch,,,,"Syphilitic bursitis, pelvic region and thigh",-1,
42618665,"Localized osteoporosis [Lequesne], other",4004623,Localized osteoporosis - Lequesne,exactMatch,,,,Localized osteoporosis [Lequesne],4004623,Localized osteoporosis - Lequesne
42618963,"Subacute osteomyelitis, ankle and foot",4284844,Subacute osteomyelitis,broadMatch,,,,"Subacute osteomyelitis, ankle and foot",-1,
42619005,"Other osteomyelitis, multiple sites",134137,Osteomyelitis of multiple sites,exactMatch,,,,"osteomyelitis, multiple sites",-1,
42619027,"Idiopathic aseptic necrosis of bone, forearm",4326828,Osteonecrosis of bone of upper limb,broadMatch,,,,"Idiopathic aseptic necrosis of bone, forearm",-1,
42619363,"Juvenile idiopathic scoliosis, multiple sites in spine",4067872,Adolescent idiopathic scoliosis,broadMatch,,,,"Juvenile idiopathic scoliosis, multiple sites in spine",-1,
42890581,Haemangioma of bone,37310560,Hemangioma of bone,exactMatch,,,,Haemangioma of bone,37310560,Hemangioma of bone
43054093,Undifferentiated nasopharyngeal carcinoma,4306501,Undifferentiated carcinoma of nasopharynx,exactMatch,,,,Undifferentiated nasopharyngeal carcinoma,-1,
43054172,Myxofibrosarcoma,36716855,Primary myxofibrosarcoma,exactMatch,,,,Myxofibrosarcoma,45771359,Myxofibrosarcoma
44503431,"Neoplasm, benign of cerebral meninges",376063,Benign neoplasm of cerebral meninges,exactMatch,,,,"Neoplasm, benign of cerebral meninges",-1,
44503495,"Astrocytoma, NOS, of brain stem",37016118,Astrocytoma of brain stem,exactMatch,,,,"Astrocytoma, brain stem",-1,
44504255,"Neoplasm, benign of vulva, NOS",438390,Benign neoplasm of vulva,exactMatch,,,,Benign neoplasm of vulva,438390,Benign neoplasm of vulva
44505202,"Neoplasm, benign of placenta",4242817,Benign neoplasm of placenta,exactMatch,,,,"Neoplasm, benign of placenta",-1,
44819370,Human herpesvirus 6 encephalitis,40479557,Encephalitis caused by human herpesvirus 6 infection,exactMatch,,,,Human herpesvirus 6 encephalitis,-1,
44819551,"Other and unspecified alcohol dependence, episodic",435243,Alcohol dependence,exactMatch,435532.0,Episodic chronic alcoholism,exactMatch,"alcohol dependence, episodic",-1,
44819592,"Migraine, unspecified",318736,Migraine,exactMatch,,,,Migraine,318736,Migraine
44819790,"Duodenitis, without mention of hemorrhage",433516,Duodenitis,exactMatch,,,,Duodenitis without hemorrhage,-1,
44820068,Other abnormality of urination,45757776,Abnormal urination,exactMatch,,,,abnormality of urination,-1,
44821095,Exfoliation due to erythematous condition involving 10-19 percent of body surface,40481101,Erythema of skin,broadMatch,,,,Exfoliation due to erythematous condition involving 10-19 percent of body surface,-1,
44821154,"Enthesopathy of elbow, unspecified",73842,Enthesopathy of elbow region,exactMatch,,,,Enthesopathy of elbow,73842,Enthesopathy of elbow region
44821454,Accidents caused by transmission machinery,439456,Accident caused by power transmission machinery,exactMatch,,,,Accidents caused by transmission machinery,-1,
44821843,Other choreas,440990,Chorea,exactMatch,,,,chorea,440990,Chorea
44821875,Other macular scars,372907,Scarred macula,exactMatch,,,,macular scars,372907,Scarred macula
44822511,Poisoning by antiasthmatics,316577,Poisoning by antiasthmatic,exactMatch,,,,Poisoning by antiasthmatics,316577,Poisoning by antiasthmatic
44824112,"Other specified types of schizophrenia, subchronic",440373,Subchronic schizophrenia,exactMatch,,,,"schizophrenia, subchronic",-1,
44824615,Other vomiting in newborn,4169915,Vomiting in newborn,exactMatch,,,,vomiting in newborn,4169915,Vomiting in newborn
44825829,Psychomotor deficit,4220292,Impaired psychomotor performance,exactMatch,42535018.0,Cognitive deficit in psychomotor function,exactMatch,Psychomotor deficit,-1,
44826331,Madura foot,196329,Mycetoma of foot,exactMatch,,,,Madura foot,196329,Mycetoma of foot
44826498,Episodic mood disorders,44784632,Episodic mood disorder,exactMatch,,,,Episodic mood disorders,44784632,Episodic mood disorder
44826645,Cerebral embolism without mention of cerebral infarction,375557,Cerebral embolism,exactMatch,,,,Cerebral embolism,375557,Cerebral embolism
44827043,"Open dislocation of hip, unspecified site",75669,Open dislocation of hip,exactMatch,,,,Open dislocation of hip,75669,Open dislocation of hip
44827270,Late effects of self-inflicted injury,435446,Late effect of self inflicted injury,exactMatch,,,,Late effects of self-inflicted injury,435446,Late effect of self inflicted injury
44827457,"Tuberculosis of bronchus, tubercle bacilli not found by bacteriological examination, but tuberculosis confirmed histologically",256896,Tuberculosis of bronchus,exactMatch,,,,Tuberculosis of bronchus,256896,Tuberculosis of bronchus
44827613,Other specified acquired hypothyroidism,138384,Acquired hypothyroidism,exactMatch,,,,acquired hypothyroidism,138384,Acquired hypothyroidism
44827777,Mitral valve insufficiency and aortic valve stenosis,320115,Mitral insufficiency and aortic stenosis,exactMatch,,,,Mitral valve insufficiency and aortic valve stenosis,-1,
44827905,"Other specified disorders of uterus, not elsewhere classified",200780,Disorder of uterus,exactMatch,,,,disorders of uterus,200780,Disorder of uterus
44827989,"Other phlebitis and thrombosis complicating pregnancy and the puerperium, delivered, with mention of postpartum complication",444094,Finding related to pregnancy,broadMatch,,,,"phlebitis and thrombosis complicating pregnancy and the puerperium, delivered, with postpartum complication",-1,
44828277,Late effects of other and unspecified injuries,435119,Late effect of injury,exactMatch,,,,Late effects of injuries,435119,Late effect of injury
44828833,Dissociative identity disorder,435230,Multiple personality disorder,exactMatch,,,,Dissociative identity disorder,435230,Multiple personality disorder
44828968,Mitral valve stenosis and aortic valve insufficiency,321041,Mitral stenosis and aortic insufficiency,exactMatch,,,,Mitral valve stenosis and aortic valve insufficiency,-1,
44829488,Anaphylactic reaction due to vaccination,37163629,Anaphylaxis caused by component of vaccine product,exactMatch,,,,Anaphylactic reaction due to vaccination,-1,
44829563,"Poisoning by other gases, undetermined whether accidentally or purposely inflicted",40493247,Poisoning by fumes,exactMatch,608027.0,Poisoning caused by gaseous substance,exactMatch,Poisoning by other gases,-1,
44829711,"Tuberculoma of brain, tubercle bacilli not found by bacteriological examination, but tuberculosis confirmed histologically",375732,Tuberculoma of brain,exactMatch,,,,Tuberculoma of brain,375732,Tuberculoma of brain
44829752,Hepatitis E with hepatic coma,377604,Hepatic coma,broadMatch,,,,Hepatitis E with hepatic coma,-1,
44829905,Graft-versus-host disease,443216,Graft versus host disease,exactMatch,,,,Graft-versus-host disease,443216,Graft versus host disease
44830208,Kidney failure following abortion and ectopic and molar pregnancies,444094,Finding related to pregnancy,broadMatch,,,,Kidney failure following abortion and ectopic and molar pregnancies,-1,
44830295,Unspecified disorder of lactation,80471,Disorder of lactation,exactMatch,,,,disorder of lactation,80471,Disorder of lactation
44830450,Other symptoms involving urinary system,4024000,Urinary system finding,exactMatch,74174.0,Urinary symptoms,exactMatch,symptoms involving urinary system,-1,
44830528,Intracranial injury of other and unspecified nature with open intracranial wound,438590,Brain injury with open intracranial wound,exactMatch,,,,Intracranial injury with open intracranial wound,-1,
44830588,Full-thickness skin loss due to burn [third degree NOS] of trunk,198911,Full thickness burn of trunk,exactMatch,,,,third degree burn of trunk,198911,Full thickness burn of trunk
44830712,Assault by submersion [drowning],439448,Assault by drowning,exactMatch,,,,Assault by submersion [drowning],-1,
44830718,Terrorism involving other means,439237,Assault,broadMatch,,,,Terrorism,4106471,Terrorism
44830798,Other urinary problems,4024000,Urinary system finding,exactMatch,75865.0,Disorder of the urinary system,exactMatch,urinary problems,-1,
44831576,Late anemia of fetus or newborn due to isoimmunization,4071073,Late anemia of newborn due to isoimmunization,exactMatch,,,,Late anemia of fetus or newborn due to isoimmunization,-1,
44832349,Disorders of visual cortex associated with neoplasms,4109398,Visual cortex disorder due to neoplasm,exactMatch,,,,Disorders of visual cortex associated with neoplasms,-1,
44833187,"Tuberculous fibrosis of lung, bacteriological or histological examination not done",258335,Tuberculous fibrosis of lung,exactMatch,,,,Tuberculous fibrosis of lung,258335,Tuberculous fibrosis of lung
44833191,"Tuberculous meningitis, unspecified",441775,Tuberculosis of meninges,exactMatch,,,,Tuberculous meningitis,441775,Tuberculosis of meninges
44833229,Other specified viral meningitis,433403,Viral meningitis,exactMatch,,,,viral meningitis,433403,Viral meningitis
44833445,"Persistent migraine aura with cerebral infarction, with intractable migraine, so stated, with status migrainosus",377844,Status migrainosus,broadMatch,,,,"Persistent migraine aura with cerebral infarction, with intractable migraine, so stated, with status migrainosus",-1,
44833605,"Upper respiratory tract hypersensitivity reaction, site unspecified",254387,Upper respiratory tract hypersensitivity reaction,exactMatch,,,,Upper respiratory tract hypersensitivity reaction,254387,Upper respiratory tract hypersensitivity reaction
44833743,"Other congenital or acquired abnormality of cervix, delivered, with or without mention of antepartum condition",442781,Disorder of uterine cervix,broadMatch,,,,"congenital or acquired abnormality of cervix, delivered",-1,
44834882,"Peripheral neuritis in pregnancy, postpartum condition or complication",4062566,Peripheral neuritis in pregnancy with postnatal complication,exactMatch,,,,"Peripheral neuritis in pregnancy, postpartum condition or complication",-1,
44834899,"Other multiple pregnancy with fetal loss and retention of one or more fetus(es), delivered, with or without mention of antepartum condition",4069761,Retained fetal tissue,broadMatch,,,,"multiple pregnancy with fetal loss and retention of one or more fetuses, delivered",-1,
44834936,"Superficial thrombophlebitis complicating pregnancy and the puerperium, delivered, with or without mention of antepartum condition",4041280,Postpartum finding,broadMatch,,,,"Superficial thrombophlebitis complicating pregnancy and the puerperium, delivered",-1,
44835126,"Open fractures involving skull or face with other bones, without mention of intracranial injury, with brief [less than one hour] loss of consciousness",4264281,Open fracture,broadMatch,,,,"Open fractures involving skull or face with other bones, with brief loss of consciousness",-1,
44835800,"Opioid type dependence, unspecified",438120,Opioid dependence,exactMatch,,,,Opioid type dependence,-1,
44836554,Accident caused by unspecified electric current,435146,Accident caused by electric current,exactMatch,,,,Accident caused by electric current,435146,Accident caused by electric current
44837245,"Diabetes mellitus of mother, complicating pregnancy, childbirth, or the puerperium, unspecified as to episode of care or not applicable",194700,"Diabetes mellitus in mother complicating pregnancy, childbirth AND/OR puerperium",exactMatch,,,,"Diabetes mellitus of mother, complicating pregnancy, childbirth, or the puerperium",-1,
44837370,"Chronic osteomyelitis, site unspecified",134735,Chronic osteomyelitis,exactMatch,,,,Chronic osteomyelitis,134735,Chronic osteomyelitis
45420635,Hypertrophic cicatrix,4058388,Hypertrophic scar,exactMatch,,,,Hypertrophic cicatrix,4058388,Hypertrophic scar
45422081,Serum cystatin C level,37208600,Cystatin C mass concentration in serum,exactMatch,4248803.0,Serum cystatin C measurement,exactMatch,Serum cystatin C level,-1,
45422256,B12 defic. initial assessment,4063247,B12 deficiency initial assessment,exactMatch,,,,B12 defic. initial assessment,-1,
45423748,Caesarean delivery unspecified,193277,Deliveries by cesarean,exactMatch,4015701.0,Cesarean section,exactMatch,Caesarean delivery,193277,Deliveries by cesarean
45431148,"[X]Fall on and from scaffolding, occurrence at unspecified place",432804,Fall from scaffold,exactMatch,,,,Fall on and from scaffolding,-1,
45431993,Faeces examination - colour,4021487,Finding of color of stool,exactMatch,4065548.0,Color of stool,exactMatch,Faeces examination - colour,-1,
45433967,[D]Urethral discharge NOS,196821,Urethral discharge,exactMatch,,,,Urethral discharge,196821,Urethral discharge
45439381,Fluid diet,4033731,Liquid diet,exactMatch,,,,Fluid diet,4033731,Liquid diet
45441681,O/E - aegophony,4064823,Egophony,exactMatch,,,,O/E - aegophony,-1,
45441866,60 minute serum TSH level,4195346,Measurement of serum thyroid stimulating hormone concentration 60 minutes after challenge,exactMatch,,,,60 minute serum TSH level,4195346,Measurement of serum thyroid stimulating hormone concentration 60 minutes after challenge
45445431,B12 defic.follow-up assessment,4063248,B12 deficiency follow-up assessment,exactMatch,,,,B12 defic.follow-up assessment,-1,
45448373,Nasal allergy challenge,4064986,Nasal provocation test,exactMatch,,,,Nasal allergy challenge,4064986,Nasal provocation test
45448438,Omega-5 gliadin IgE level,40480139,Measurement of immunoglobulin E antibody to omega-5 gliadin,exactMatch,,,,Omega-5 gliadin IgE level,40480139,Measurement of immunoglobulin E antibody to omega-5 gliadin
45448546,Total count of motile sperm,4043611,Total count of motile spermatozoa,exactMatch,,,,Total count of motile sperm,4043611,Total count of motile spermatozoa
45454963,O/E - stoma,138667,Stoma finding,exactMatch,4248521.0,Observation of appearance of stoma,exactMatch,O/E - stoma,-1,
45457257,[D]Urinary system symptoms,74174,Urinary symptoms,exactMatch,,,,[D]Urinary system symptoms,-1,
45458717,Endocrine monitoring NOS,4063245,Endocrine disorder monitoring,exactMatch,,,,Endocrine monitoring,-1,
45461957,Valaciclovir level,44790058,Valaciclovir measurement,exactMatch,,,,Valaciclovir level,44790058,Valaciclovir measurement
45461999,Vomit pH,4055572,Measurement of vomit pH,exactMatch,,,,Vomit pH,4055572,Measurement of vomit pH
45462167,Prognosis poor,4063380,Prognosis bad,exactMatch,,,,Prognosis poor,4063380,Prognosis bad
45465320,Serum parathyroid hormone,4154637,Serum parathyroid hormone measurement,exactMatch,,,,Serum parathyroid hormone,-1,
45465331,Serum bicarbonate,4150494,Serum bicarbonate measurement,exactMatch,,,,Serum bicarbonate,-1,
45465339,Serum methaemalbumin level,4198877,Serum methemalbumin measurement,exactMatch,,,,Serum methaemalbumin level,4198877,Serum methemalbumin measurement
45467089,Breech presentation NOS,74698,Breech presentation,exactMatch,,,,Breech presentation,74698,Breech presentation
45467346,Naevus flammeus,4219552,Port-wine stain of skin,exactMatch,,,,Naevus flammeus,4219552,Port-wine stain of skin
45468855,CSF electrophoresis,4043594,CSF: electrophoresis,exactMatch,,,,CSF electrophoresis,4043594,CSF: electrophoresis
45471238,Adverse reaction to thyroxine sodium,4162153,Thyroxine adverse reaction,exactMatch,,,,Adverse reaction to thyroxine sodium,-1,
45472951,Admission to hospital,8715,Hospital admission,exactMatch,,,,Admission to hospital,8715,Hospital admission
45475055,Owner-occupier,4059643,Lives in own home,exactMatch,,,,Owner-occupier,4059643,Lives in own home
45488815,Synovial fluid exam. NOS,4057464,Synovial fluid examination,exactMatch,,,,Synovial fluid examination,4057464,Synovial fluid examination
45488830,Culture - bacteriology,4016945,Bacterial culture,exactMatch,,,,Culture - bacteriology,-1,
45491843,O/E - strabismus NOS,4329707,Strabismus,exactMatch,,,,strabismus,4329707,Strabismus
45494505,[X]Fall on/from ladder,432803,Fall from ladder,exactMatch,,,,[X]Fall on/from ladder,-1,
45501759,O/E - strabismus - squint,4329707,Strabismus,exactMatch,,,,O/E - strabismus - squint,-1,
45511686,O/E wound healing delayed,37312235,Delayed healing of wound,exactMatch,,,,O/E wound healing delayed,-1,
45515364,Brucella serology,4017915,Measurement of Brucella species antibody,exactMatch,,,,Brucella serology,4017915,Measurement of Brucella species antibody
45515541,Urine screen due,4064384,Urine screening due,exactMatch,,,,Urine screen due,4064384,Urine screening due
45516780,Low vision,373786,Abnormal vision,broadMatch,,,,Low vision,-1,
45518269,Child lives with father,4072595,Lives with father,exactMatch,,,,Child lives with father,-1,
45518428,O/E - R.femoral pulse present,37312075,Pulse present in right femoral artery,exactMatch,,,,O/E - R.femoral pulse present,-1,
45518629,Urine sex hor. 24hr. assay NOS,4055429,Urine sex hormone 24 hour assay,exactMatch,,,,Urine sex hormone 24 hour assay,4055429,Urine sex hormone 24 hour assay
45520843,"Injured by rolling stock, NOS",4072660,Hit by railway vehicle,broadMatch,4072660.0,Hit by railway vehicle,exactMatch,Injured by rolling stock,-1,
45522851,Malingerer,4051630,Malingering,exactMatch,,,,Malingerer,-1,
45532957,Other heavy chain disease,4288751,Heavy chain disease,exactMatch,,,,heavy chain disease,4288751,Heavy chain disease
45533656,"Pressure ulcer of unspecified hip, stage 1",37170748,Pressure injury of hip stage I,exactMatch,,,,"Pressure ulcer of hip, stage 1",-1,
45534326,"Diseases of the respiratory system complicating pregnancy, second trimester",4060429,"Disease of the respiratory system complicating pregnancy, childbirth and/or the puerperium",broadMatch,,,,"Diseases of the respiratory system complicating pregnancy, second trimester",-1,
45537491,"Assault by other bodily force, subsequent encounter",4054796,Assault with body part,exactMatch,,,,Assault by other bodily force,-1,
45537526,"War operations involving rubber bullets, military personnel, initial encounter",434834,War injury due to rubber bullets,exactMatch,,,,War operations involving rubber bullets,-1,
45537844,Malignant poorly differentiated neuroendocrine tumors,761025,Poorly differentiated malignant carcinoid tumor,exactMatch,,,,Malignant poorly differentiated neuroendocrine tumors,-1,
45537885,"Carcinoma in situ of breast, unspecified",81250,Carcinoma in situ of breast,exactMatch,,,,Carcinoma in situ of breast,81250,Carcinoma in situ of breast
45537984,Fabry (-Anderson) disease,4042934,Fabry's disease,exactMatch,,,,Fabry (-Anderson) disease,-1,
45538653,"Drug-induced gout, vertebrae",46270460,Gout of vertebra caused by drug,exactMatch,,,,"Drug-induced gout, vertebrae",-1,
45538982,"Osteonecrosis due to previous trauma, other site",37164275,Osteonecrosis due to trauma,exactMatch,,,,Osteonecrosis due to previous trauma,-1,
45539079,(Induced) termination of pregnancy with unspecified complications,37162983,Disorder following induced termination of pregnancy,exactMatch,,,,Induced termination of pregnancy with complications,-1,
45539133,"Continuing pregnancy after elective fetal reduction of one fetus or more, second trimester, fetus 1",4244438,Second trimester pregnancy,broadMatch,,,,"Continuing pregnancy after elective fetal reduction of one fetus or more, second trimester, fetus 1",-1,
45542656,"Mature T/NK-cell lymphomas, unspecified, lymph nodes of inguinal region and lower limb",37165866,Mature T-cell AND/OR NK cell neoplasm,broadMatch,,,,"Mature T/NK-cell lymphomas, lymph nodes of inguinal region and lower limb",-1,
45543904,Vaginismus,193261,Vaginospasm,exactMatch,,,,Vaginismus,-1,
45543919,"Infections of bladder in pregnancy, third trimester",4146482,Urinary tract infection in pregnancy,broadMatch,,,,"Infections of bladder in pregnancy, third trimester",-1,
45547303,Encounter for elective termination of pregnancy,4081422,Elective termination of pregnancy,exactMatch,,,,elective termination of pregnancy,4081422,Elective termination of pregnancy
45547418,Gonococcal arthritis,74864,Gonococcal infection of joint,exactMatch,,,,Gonococcal arthritis,74864,Gonococcal infection of joint
45547559,"Juvenile myelomonocytic leukemia, not having achieved remission",40482847,Juvenile myelomonocytic leukemia,exactMatch,,,,"Juvenile myelomonocytic leukemia, not having achieved remission",-1,
45547832,Endothelial corneal dystrophy,443740,Corneal endothelial dystrophy,exactMatch,,,,Endothelial corneal dystrophy,443740,Corneal endothelial dystrophy
45547895,"Glaucoma secondary to other eye disorders, left eye",436398,Glaucoma associated with ocular disorder,broadMatch,,,,"Glaucoma secondary to eye disorders, left eye",-1,
45548255,Rheumatoid heart disease with rheumatoid arthritis of unspecified hip,4116150,Rheumatoid arthritis of hip,broadMatch,,,,Rheumatoid heart disease with rheumatoid arthritis of hip,-1,
45548294,"Drug-induced gout, unspecified ankle and foot",46270453,Gout of ankle and/or foot caused by drug,exactMatch,,,,"Drug-induced gout, ankle and foot",-1,
45548832,Labor and delivery complicated by other evidence of fetal stress,4063307,Labor and delivery complicated by biochemical evidence of fetal stress,exactMatch,,,,Labor and delivery complicated by fetal stress,-1,
45548837,Other embolism in childbirth,4185607,Embolism,broadMatch,,,,embolism in childbirth,-1,
45552225,Cutaneous chromomycosis,4080755,Cutaneous chromoblastomycosis,exactMatch,,,,Cutaneous chromomycosis,-1,
45552460,"Other psychoactive substance abuse with intoxication, unspecified",607217,Psychoactive substance-induced intoxication,exactMatch,,,,psychoactive substance abuse with intoxication,-1,
45552782,Other acute ischaemic heart diseases,319844,Acute ischemic heart disease,exactMatch,,,,acute ischaemic heart diseases,319844,Acute ischemic heart disease
45553035,"Other reactive arthropathies, unspecified wrist",1244729,Reactive arthritis of joint of wrist region,exactMatch,,,,"reactive arthropathies, wrist",-1,
45555996,"Poisoning by amphetamines, intentional self-harm, initial encounter",606763,Intentional amphetamine and/or amphetamine derivative poisoning,exactMatch,,,,"Poisoning by amphetamines, intentional self-harm",-1,
45556926,Other varicella complications,437791,Chickenpox with complication,exactMatch,,,,varicella complications,-1,
45557037,Waldenstrm macroglobulinaemia,4098597,Waldenstrm macroglobulinemia,exactMatch,,,,Waldenstrm macroglobulinaemia,-1,
45557206,"Reaction to severe stress, and adjustment disorders",4152371,Stress and adjustment reaction,exactMatch,,,,"Reaction to severe stress, and adjustment disorders",-1,
45557282,"Paralytic lagophthalmos unspecified eye, unspecified eyelid",375821,Paralytic lagophthalmos,exactMatch,,,,Paralytic lagophthalmos,375821,Paralytic lagophthalmos
45557771,"Pauciarticular juvenile rheumatoid arthritis, unspecified elbow",1076080,Juvenile idiopathic arthritis of elbow,exactMatch,1076080.0,Juvenile idiopathic arthritis of elbow,broadMatch,"Pauciarticular juvenile rheumatoid arthritis, elbow",-1,
45557863,Mucocutaneous lymph node syndrome [Kawasaki],314381,Acute febrile mucocutaneous lymph node syndrome,exactMatch,,,,Mucocutaneous lymph node syndrome [Kawasaki],-1,
45557973,"Other infective bursitis, left wrist",4184657,Bursitis of wrist,broadMatch,,,,"infective bursitis, left wrist",-1,
45558103,"Major osseous defect, left lower leg",72986,Disorder of lower leg,broadMatch,,,,"Major osseous defect, left lower leg",-1,
45558312,"Other placental disorders, third trimester",4053583,Disorder of placenta,broadMatch,,,,"placental disorders, third trimester",-1,
45561667,Personal history of allergy to penicillin,4240903,Allergy to penicillin,exactMatch,,,,Personal history of allergy to penicillin,-1,
45561802,Basal cell carcinoma of skin of other part of trunk,4297668,Basal cell carcinoma of truncal skin,exactMatch,,,,Basal cell carcinoma of skin of trunk,-1,
45561948,Type 1 diabetes mellitus with diabetic amyotrophy,4143857,Lumbosacral radiculoplexus neuropathy due to type 1 diabetes mellitus,exactMatch,,,,Type 1 diabetes mellitus with diabetic amyotrophy,-1,
45562265,Other strabismus,4329707,Strabismus,exactMatch,,,,strabismus,4329707,Strabismus
45563138,"Oligohydramnios, second trimester, other fetus",434111,Oligohydramnios,broadMatch,,,,"Oligohydramnios, second trimester",-1,
45563192,"Protozoal diseases complicating pregnancy, unspecified trimester",36715504,Protozoal disease complicating pregnancy childbirth and the puerperium,exactMatch,36715504.0,Protozoal disease complicating pregnancy childbirth and the puerperium,broadMatch,Protozoal diseases complicating pregnancy,-1,
45563320,Polydipsia,432454,Excessive thirst,exactMatch,,,,Polydipsia,-1,
45566422,"Antenatal screening, unspecified",4087235,Antenatal screening,exactMatch,,,,Antenatal screening,4087235,Antenatal screening
45566515,Gonococcal spondylopathy,72562,Gonococcal spondylitis,exactMatch,,,,Gonococcal spondylopathy,-1,
45566588,Other specified malignant neoplasm of skin of breast,4247348,Primary malignant neoplasm of skin of breast,exactMatch,,,,malignant neoplasm of skin of breast,-1,
