source_concept_id,source_term,target_concept_id,target_concept_name,predicate,target_concept_id_b,target_concept_name_b,predicate_b,cleaned_term,mapped_concept_id,mapped_concept_name
37225373,"Other chronic haematogenous osteomyelitis, ankle and foot",137077,Chronic osteomyelitis of ankle and/or foot,exactMatch,,,,"chronic haematogenous osteomyelitis, ankle and foot",-1,
37225618,"Osteonecrosis in other diseases classified elsewhere, multiple sites",4287786,Osteonecrosis,broadMatch,,,,"Osteonecrosis, multiple sites",-1,
37225693,"Chondrolysis, forearm",136779,Disorder of forearm,broadMatch,,,,"Chondrolysis, forearm",-1,
37225820,"Recurrent and persistent haematuria, other",79864,Hematuria syndrome,broadMatch,,,,Recurrent and persistent haematuria,-1,
37282746,Familial (FPAH),4119611,Familial primary pulmonary hypertension,exactMatch,,,,Familial (FPAH),-1,
37320084,Punctate keratosis,4300110,Punctate palmoplantar keratoderma,broadMatch,,,,Punctate keratosis,-1,
37383969,Exanthem,140214,Eruption,broadMatch,,,,Exanthem,140214,Eruption
37402416,"Dementia in other diseases classified elsewhere, moderate, with agitation",762704,Moderate dementia,broadMatch,,,,"Dementia, moderate, with agitation",-1,
37402457,"Unspecified dementia, severe, with anxiety",441542,Anxiety,broadMatch,,,,"dementia, severe, with anxiety",-1,
37402466,"Cocaine use, unspecified, in remission",37162280,Disorder caused by psychoactive substance,broadMatch,,,,"Cocaine use, in remission",-1,
37402467,"Other stimulant use, unspecified, in remission",37164332,Nondependent psychostimulant abuse in remission,exactMatch,,,,"stimulant use, in remission",-1,
37402468,"Hallucinogen use, unspecified, in remission",37162280,Disorder caused by psychoactive substance,broadMatch,,,,"Hallucinogen use, in remission",-1,
37402469,"Inhalant use, unspecified, in remission",37162280,Disorder caused by psychoactive substance,broadMatch,,,,"Inhalant use, in remission",-1,
37604135,Abnormal findings in cerebrospinal fluid,4065770,Cerebrospinal fluid examination abnormal,exactMatch,,,,Abnormal findings in cerebrospinal fluid,-1,
37604162,Abnormal results of liver function studies,438878,Liver function tests outside reference range,exactMatch,,,,Abnormal results of liver function studies,438878,Liver function tests outside reference range
37604386,Adverse effects in the therapeutic use of antiparkinsonism drugs,443602,Adverse reaction to antiparkinsonism drug,exactMatch,,,,Adverse effects in the therapeutic use of antiparkinsonism drugs,-1,
37604557,Attention to artificial openings,1242753,Attention to stoma,exactMatch,,,,Attention to artificial openings,-1,
37604869,"Acute onset vascular dementia with other, mainly hallucinatory symptoms, severe",4046089,Vascular dementia of acute onset,broadMatch,,,,"Acute onset vascular dementia with hallucinatory symptoms, severe",-1,
37605180,"Dementia in Creutzfeldt-Jakob disease, with other symptoms, predominantly hallucinatory, mild",4180284,Dementia due to Creutzfeldt Jakob disease,broadMatch,,,,"Dementia in Creutzfeldt-Jakob disease, predominantly hallucinatory, mild",-1,
37605737,Ventricular premature depolarization,4089462,Ventricular premature complex,exactMatch,,,,Ventricular premature depolarization,4089462,Ventricular premature complex
37605894,Hereditary factor VIII deficiency,434007,Hereditary factor VIII deficiency disease,exactMatch,,,,Hereditary factor VIII deficiency,-1,
37606067,Benign lipomatous neoplasm,4112852,Benign lipomatous tumor,exactMatch,,,,Benign lipomatous neoplasm,-1,
37606919,Other osteomyelitis,141663,Osteomyelitis,exactMatch,,,,osteomyelitis,141663,Osteomyelitis
37607004,Endocarditis and heart valve disorders in diseases classified elsewhere,440736,Endocarditis associated with another disorder,broadMatch,,,,Endocarditis and heart valve disorders in diseases classified elsewhere,-1,
37607152,Other diseases of Bartholin gland,4103650,Disorder of Bartholin's gland,exactMatch,,,,diseases of Bartholin gland,-1,
37607165,Other schizophrenia,435783,Schizophrenia,exactMatch,,,,schizophrenia,35823457,Schizophrenia
37607287,Alveolar and parietoalveolar conditions,257907,Disorder of lung,broadMatch,,,,Alveolar and parietoalveolar conditions,-1,
37607571,Exposure to noise,434238,Exposed to noise,exactMatch,,,,Exposure to noise,434238,Exposed to noise
37607584,Adverse effects in the therapeutic use of aminoglycosides,4099883,Aminoglycosides adverse reaction,exactMatch,,,,Adverse effects in the therapeutic use of aminoglycosides,-1,
37607634,"Naevus, non-neoplastic",135287,Non-neoplastic nevus,exactMatch,,,,"Naevus, non-neoplastic",-1,
37608196,Disorders of zinc metabolism,4263312,Disorder of zinc metabolism,exactMatch,,,,Disorders of zinc metabolism,4263312,Disorder of zinc metabolism
37608257,Non-neuropathic heredofamilial amyloidosis,4030362,Familial non-neuropathic amyloidosis,exactMatch,,,,Non-neuropathic heredofamilial amyloidosis,-1,
37608458,Other retinal detachments,378414,Retinal detachment,exactMatch,,,,retinal detachments,36769851,Retinal detachment
37609039,Nonrheumatic tricuspid (valve) stenosis with insufficiency,4111414,Non-rheumatic tricuspid valve stenosis with insufficiency,exactMatch,,,,Nonrheumatic tricuspid (valve) stenosis with insufficiency,-1,
37609134,Other specified diseases of upper respiratory tract,254068,Disorder of upper respiratory system,exactMatch,,,,diseases of upper respiratory tract,254068,Disorder of upper respiratory system
37609365,Lack of physical exercise,4165091,Lack of exercise,exactMatch,,,,Lack of physical exercise,4165091,Lack of exercise
37609391,Other mononeuropathies of lower limb,43531028,Mononeuropathy of lower limb,exactMatch,,,,mononeuropathies of lower limb,43531028,Mononeuropathy of lower limb
37609802,Active stage of trachoma,375736,"Trachoma, active stage",exactMatch,,,,Active stage of trachoma,-1,
37610053,Malignant neoplasm: Overlapping lesion of corpus uteri,198082,Overlapping malignant neoplasm of body of uterus,exactMatch,,,,Malignant neoplasm: Overlapping lesion of corpus uteri,-1,
37610161,Toxic epidermal necrolysis [Lyell],35625873,Lyell syndrome,exactMatch,,,,Toxic epidermal necrolysis,35625873,Lyell syndrome
37610986,"Tricuspid valve disease, unspecified",316993,Tricuspid valve disorder,exactMatch,,,,Tricuspid valve disease,316993,Tricuspid valve disorder
37611086,Acute posthaemorrhagic anaemia,434894,Acute posthemorrhagic anemia,exactMatch,,,,Acute posthaemorrhagic anaemia,434894,Acute posthemorrhagic anemia
37611262,Extra marker chromosomes,40480271,Extra unidentified structurally abnormal chromosome,exactMatch,,,,Extra marker chromosomes,-1,
37611631,Rotator cuff syndrome,4212887,Disorder of rotator cuff,exactMatch,,,,Rotator cuff syndrome,-1,
37611822,Pilonidal cyst without abscess,4165681,Pilonidal cyst,exactMatch,,,,Pilonidal cyst without abscess,-1,
37612241,Other gender identity disorders,4338512,Gender identity disorder,exactMatch,,,,gender identity disorders,4338512,Gender identity disorder
37612559,Gonococcal pharyngitis,30333,Gonorrhea of pharynx,exactMatch,,,,Gonococcal pharyngitis,30333,Gonorrhea of pharynx
37613302,Endometrial glandular hyperplasia,200775,Endometrial hyperplasia,exactMatch,,,,Endometrial glandular hyperplasia,-1,
37613473,Eclampsia in labour,4034096,Eclampsia in labor,exactMatch,,,,Eclampsia in labour,4034096,Eclampsia in labor
37613552,Irritant contact dermatitis due to other agents,4004352,Irritant contact dermatitis,exactMatch,,,,Irritant contact dermatitis,4004352,Irritant contact dermatitis
37613645,Acn excorie ,4004094,Excoriated acne,exactMatch,,,,Acn excorie ,-1,
37613740,Hepatitis A with hepatic coma,194856,Hepatic coma due to viral hepatitis A,exactMatch,,,,Hepatitis A with hepatic coma,-1,
37613827,"Mental disorders and diseases of the nervous system complicating pregnancy, childbirth and the puerperium",4063155,"Disease of nervous system complicating pregnancy, childbirth and puerperium",broadMatch,,,,"Mental disorders and diseases of the nervous system complicating pregnancy, childbirth and the puerperium",-1,
37614022,Supervision of normal first pregnancy,4061424,Antenatal care: primigravida,broadMatch,,,,Supervision of normal first pregnancy,-1,
37614126,"Type 2 diabetes mellitus, with neurological complications",376065,Disorder of nervous system due to type 2 diabetes mellitus,exactMatch,,,,"Type 2 diabetes mellitus, with neurological complications",-1,
37615331,"Mixed conductive and sensorineural hearing loss, unspecified",379832,Mixed conductive AND sensorineural hearing loss,exactMatch,,,,Mixed conductive and sensorineural hearing loss,379832,Mixed conductive AND sensorineural hearing loss
37615395,Embolism and thrombosis of other arteries,312337,Arterial embolus and thrombosis,exactMatch,,,,Embolism and thrombosis of arteries,-1,
37622382,Artery dissection,46272492,Dissection of artery,exactMatch,,,,Artery dissection,-1,
37688988,Aortic sclerosis,4195690,Aortic valve sclerosis,exactMatch,,,,Aortic sclerosis,4195690,Aortic valve sclerosis
42483611,Allergic purpura,4101602,Immunoglobulin A vasculitis,exactMatch,,,,Allergic purpura,-1,
42483830,Brucellosis due to Brucella melitensis,443590,Infection caused by Brucella melitensis,exactMatch,,,,Brucellosis due to Brucella melitensis,-1,
42483858,"Zoonotic bacterial disease, unspecified",432545,Bacterial infectious disease,broadMatch,,,,Zoonotic bacterial disease,-1,
42484116,Other specified viral encephalitis,372547,Viral encephalitis,exactMatch,,,,viral encephalitis,372547,Viral encephalitis
42484445,Plasmodium malariae malaria without complication,438353,Quartan malaria,exactMatch,,,,Plasmodium malariae malaria without complication,-1,
42484592,Other specified infestations,432251,Parasitic disease,exactMatch,,,,infestations,432251,Parasitic disease
42484594,Unspecified parasitic disease,432251,Parasitic disease,exactMatch,,,,parasitic disease,432251,Parasitic disease
42484898,"Malignant melanoma of upper limb, including shoulder",4149851,Malignant melanoma of upper limb,exactMatch,,,,"Malignant melanoma of upper limb, including shoulder",-1,
42485220,"Non-Hodgkin lymphoma, unspecified",4038838,Non-Hodgkin's lymphoma (clinical),exactMatch,,,,Non-Hodgkin lymphoma,37156353,Non-Hodgkin lymphoma
42485669,"Neoplasm of uncertain or unknwon behavior of endocrine gland, unspecified",4302836,Neoplasm of endocrine gland,exactMatch,,,,Neoplasm of endocrine gland,4302836,Neoplasm of endocrine gland
42485732,Thalassaemia,30978,Thalassemia,exactMatch,,,,Thalassaemia,30978,Thalassemia
42485777,Anaemia in other chronic diseases classified elsewhere,437247,Anemia of chronic disease,exactMatch,,,,Anaemia in chronic diseases,-1,
42485847,Selective deficiency of immunoglobulin M[IgM],434893,Selective immunoglobulin M deficiency,exactMatch,,,,Selective deficiency of immunoglobulin M[IgM],-1,
42485922,"Nontoxic goitre, unspecified",141825,Simple goiter,exactMatch,,,,Nontoxic goitre,-1,
42486231,"Hyperaldosteronism, unspecified",195213,Hyperaldosteronism,exactMatch,,,,Hyperaldosteronism,195213,Hyperaldosteronism
42486310,Other vitamin deficiencies,436658,Vitamin deficiency,exactMatch,,,,vitamin deficiencies,436658,Vitamin deficiency
42486319,Copper deficiency,4024266,Hypocupremia,exactMatch,,,,Copper deficiency,4024266,Hypocupremia
42486358,Disorders of tyrosine metabolism,4291019,Disorder of tyrosine metabolism,exactMatch,,,,Disorders of tyrosine metabolism,4291019,Disorder of tyrosine metabolism
42486701,"Persistent mood[affective] disorder, unspe- cified",444100,Mood disorder,exactMatch,,,,"Persistent mood[affective] disorder, unspe- cified",-1,
42486889,Childhood autism,434902,Autistic disorder of childhood onset,exactMatch,,,,Childhood autism,434902,Autistic disorder of childhood onset
42486962,"Meningitis, unspecified",435785,Meningitis,exactMatch,,,,Meningitis,435785,Meningitis
42487128,"Migraine, unspecified",318736,Migraine,exactMatch,,,,Migraine,318736,Migraine
42487129,Other headache syndromes,375527,Headache disorder,exactMatch,,,,headache syndromes,-1,
42487203,Other nerve root and plexus disorders,43531046,Disorder of nerve root and/or plexus,exactMatch,,,,nerve root and plexus disorders,-1,
42487208,Nerve root and plexus compressions in spondylosis(M47.-),4105009,Nerve root and plexus compressions in spondylosis,exactMatch,,,,Nerve root and plexus compressions in spondylosis(M47.-),-1,
42487274,Congenital and developmental myasthenia,4046356,Congenital myasthenic syndrome,exactMatch,,,,Congenital and developmental myasthenia,-1,
42488431,"Nonrheumatic mitral valve disorder, unspecified",45769461,Non-rheumatic mitral valve disease,exactMatch,,,,Nonrheumatic mitral valve disorder,-1,
42488458,Isolated myocarditis,4143969,Isolated (Fiedler's) myocarditis,exactMatch,,,,Isolated myocarditis,-1,
42488570,Subdural haemorrhage (acute)(nontraumatic),42535426,Acute nontraumatic subdural hemorrhage,exactMatch,,,,Subdural haemorrhage (acute)(nontraumatic),-1,
42488804,Nonspecific lymphadenitis,316084,Lymphadenitis,exactMatch,,,,Nonspecific lymphadenitis,-1,
42489033,"Chronic obstructive pulmonary disease with acute exacerbation, unspecified, mild",257004,Acute exacerbation of chronic obstructive pulmonary disease,broadMatch,,,,"Chronic obstructive pulmonary disease with acute exacerbation, mild",-1,
42489037,Other specified chronic obstructive pulmonary disease,255573,Chronic obstructive pulmonary disease,exactMatch,,,,chronic obstructive pulmonary disease,255573,Chronic obstructive pulmonary disease
42489041,"Other specified chronic obstructive pulmonary disease, unspecified",255573,Chronic obstructive pulmonary disease,exactMatch,,,,chronic obstructive pulmonary disease,255573,Chronic obstructive pulmonary disease
42489065,Status asthmaticus,37116845,Acute severe refractory exacerbation of asthma,exactMatch,,,,Status asthmaticus,37116845,Acute severe refractory exacerbation of asthma
42489166,"Chronic respiratory failure, type I [hypoxic]",4177862,Chronic hypoxemic respiratory failure,exactMatch,,,,"Chronic respiratory failure, type I [hypoxic]",-1,
42489309,Sensitive dentine,4028685,Sensitive dentin,exactMatch,,,,Sensitive dentine,-1,
42489347,Acute periodontitis,132943,Acute periodontitis,exactMatch,,,,Acute periodontitis,132943,Acute periodontitis
42489389,"Anomaly of jaw size, unspecified",45757682,Anomaly of jaw size,exactMatch,,,,Anomaly of jaw size,45757682,Anomaly of jaw size
42489446,Other specified disorders of teeth and supporting structures,201603,Disorder of teeth AND/OR supporting structures,exactMatch,,,,disorders of teeth and supporting structures,-1,
42489473,Disturbances of salivary secretion,27587,Disturbance of salivary secretion,exactMatch,,,,Disturbances of salivary secretion,27587,Disturbance of salivary secretion
42489523,Acute erosion of stomach with haemorrhage,4143871,Erosion of stomach with hemorrhage,exactMatch,4143871.0,Acute erosion of stomach with haemorrhage,broadMatch,Acute erosion of stomach with haemorrhage,-1,
42489570,Chronic or unspecified gastrojejunal ulcer with hemorrhage,433515,Chronic gastrojejunal ulcer with hemorrhage,exactMatch,,,,Chronic gastrojejunal ulcer with hemorrhage,433515,Chronic gastrojejunal ulcer with hemorrhage
42489572,Chronic or unspecified gastrojejunal ulcer with both hemorrhage and perforation,4164920,Chronic gastrojejunal ulcer with hemorrhage and perforation,exactMatch,,,,Chronic gastrojejunal ulcer with hemorrhage and perforation,4164920,Chronic gastrojejunal ulcer with hemorrhage and perforation
42489645,Incisionall hernia with gangrene,199868,Incisional hernia with gangrene,exactMatch,,,,Incisionall hernia with gangrene,-1,
42489776,Other specified functional intestinal disorders,196151,Functional disorder of intestine,exactMatch,,,,functional intestinal disorders,-1,
42489837,Disorders of peritoneum in infectious diseases classified elsewhere,443796,Infectious peritonitis,exactMatch,,,,Disorders of peritoneum in infectious diseases classified elsewhere,-1,
42489855,"Alcoholic liver disease, unspecified",201612,Alcoholic liver damage,exactMatch,,,,Alcoholic liver disease,201612,Alcoholic liver damage
42489917,"Biliary cirrhosis, unspecified, unspecified",192675,Biliary cirrhosis,exactMatch,,,,Biliary cirrhosis,192675,Biliary cirrhosis
42489995,Other diseases of pancreas,192963,Disorder of pancreas,exactMatch,,,,diseases of pancreas,-1,
42490022,Other diseases of digestive system,4201745,Disorder of digestive system,exactMatch,,,,diseases of digestive system,-1,
42490152,Allergic contact dermatitis due to dyes,4064029,Allergic contact dermatitis caused by dye,exactMatch,,,,Allergic contact dermatitis due to dyes,-1,
42490238,Other specified papulosquamous disorders,4330878,Papulosquamous dermatosis,exactMatch,,,,papulosquamous disorders,-1,
42490240,Papulosquamous disorders in diseases classified elsewhere,4330878,Papulosquamous dermatosis,exactMatch,,,,Papulosquamous disorders in diseases classified elsewhere,-1,
42490480,Other disorders of skin and subcutaneous tissue in diseases classified elsewhere,200174,Disorder of skin and/or subcutaneous tissue,exactMatch,,,,disorders of skin and subcutaneous tissue,200174,Disorder of skin and/or subcutaneous tissue
42490575,"Arthritis in other bacterial diseases classified elsewhere, forearm",136779,Disorder of forearm,broadMatch,,,,"Arthritis, forearm",-1,
42490600,"Arthritis in other viral diseases classified elsewhere, lower leg",4094283,Lower limb joint arthritis,broadMatch,,,,"Arthritis, lower leg",-1,
42490762,Rheumatoid arthritis with involvement of other organs and systems,80809,Rheumatoid arthritis,broadMatch,,,,Rheumatoid arthritis with involvement of other organs and systems,-1,
42490880,"Seronegative rheumatoid arthritis, shoulder region",1244750,Seronegative rheumatoid arthritis of joint of shoulder region,exactMatch,,,,"Seronegative rheumatoid arthritis, shoulder region",-1,
42491304,"Other chondrocalcinosis, lower leg",437064,Chondrocalcinosis,broadMatch,,,,"chondrocalcinosis, lower leg",-1,
42491445,Lipoid dermatoarthritis(E78.8),4224167,Lipoid dermatoarthritis,exactMatch,,,,Lipoid dermatoarthritis(E78.8),-1,
42491566,"Varus deformity, NEC, multiple sites",37110367,Acquired varus deformity of limb,broadMatch,,,,"Varus deformity, multiple sites",-1,
42491704,"Loose body in joint, site unspecified",79104,Loose body in joint,exactMatch,,,,Loose body in joint,79104,Loose body in joint
42491927,Other forms of systemic lupus erythematosus,257628,Systemic lupus erythematosus,exactMatch,,,,systemic lupus erythematosus,257628,Systemic lupus erythematosus
42492095,"Other secondary scoliosis, site unspecified",4006163,Acquired scoliosis,exactMatch,,,,secondary scoliosis,-1,
42492193,"Other recurrent vertebral subluxation, occipito-atlanto-axial region",4134176,Subluxation of joint of cervical spine,broadMatch,,,,"recurrent vertebral subluxation, occipito-atlanto-axial region",-1,
42492510,"Spondylopathy in other infectious and parasitic diseases classified elsewhere, lumbosacral region",37207722,Disorder of joint of lumbosacral vertebra,broadMatch,,,,"Spondylopathy in infectious and parasitic diseases, lumbosacral region",-1,
42492784,Other calcification of muscle,40490403,Calcification of muscle,exactMatch,,,,calcification of muscle,40490403,Calcification of muscle
42492923,Other disorders of muscle in diseases classified elsewhere,137275,Disorder of muscle,exactMatch,,,,disorders of muscle,137275,Disorder of muscle
42492978,"Other synovitis and tenosynovitis, other",74728,Synovitis and tenosynovitis,exactMatch,,,,synovitis and tenosynovitis,74728,Synovitis and tenosynovitis
42493024,"Spontaneous rupture of flexor tendons, other",4188441,Spontaneous rupture of flexor tendons,exactMatch,,,,Spontaneous rupture of flexor tendons,4188441,Spontaneous rupture of flexor tendons
42493253,"Necrotising fasciitis, hand",133566,Necrotizing fasciitis,broadMatch,,,,"Necrotising fasciitis, hand",-1,
42493483,Other specified soft tissue disorders,376208,Disorder of soft tissue,exactMatch,,,,soft tissue disorders,376208,Disorder of soft tissue
42493875,Fibrous dysplasia (monostotic),4233830,Monostotic fibrous dysplasia,exactMatch,,,,Fibrous dysplasia (monostotic),-1,
42494070,"Idiopathic aseptic necrosis of bone, forearm",4326828,Osteonecrosis of bone of upper limb,broadMatch,,,,"Idiopathic aseptic necrosis of bone, forearm",-1,
42494188,"Other disorders of bone development and growth, ankle and foot",44782620,Disorder of free lower limb,broadMatch,,,,"disorders of bone development and growth, ankle and foot",-1,
42494383,"Chondromalacia, site unspecified",438531,Chondromalacia,exactMatch,,,,Chondromalacia,438531,Chondromalacia
42495121,"Incomplete other abortion, with other and unspecified complications (conditions in O08.3-O08.)",434413,Incomplete miscarriage with complication,exactMatch,,,,Incomplete abortion,-1,
42495174,Gestational [pregnancy-induced] hypertension,4167493,Pregnancy-induced hypertension,exactMatch,,,,Gestational [pregnancy-induced] hypertension,-1,
42495402,Prolonged pregnancy,432695,Post-term pregnancy,exactMatch,,,,Prolonged pregnancy,432695,Post-term pregnancy
42495425,Failed medical induction of labour,438491,Failed medical induction of labor,exactMatch,,,,Failed medical induction of labour,438491,Failed medical induction of labor
42495520,Toxic reaction to local anaesthesia during labour and delivery,4065626,Toxic reaction to local anesthetic during labor and delivery,exactMatch,,,,Toxic reaction to local anaesthesia during labour and delivery,-1,
42495796,Other respiratory distress of newborn,258866,Respiratory distress syndrome in the newborn,exactMatch,37161510.0,Neonatal respiratory distress,exactMatch,respiratory distress of newborn,-1,
42496152,"Congenital absence, atresia and stricture of auditory canal(external)",4185093,Congenital stricture of external auditory canal,broadMatch,,,,"Congenital absence, atresia and stricture of auditory canal(external)",-1,
42496228,Other specified congenital malformations of heart,312723,Congenital heart disease,exactMatch,,,,congenital malformations of heart,-1,
42496887,"Localized swelling, mass and lump of skin and subcutaneous tissue",4102120,Swelling of skin,broadMatch,,,,"Localized swelling, mass and lump of skin and subcutaneous tissue",-1,
42496937,Frequency of micturition,4270128,Frequency of urination,exactMatch,200843.0,Finding of frequency of urination,exactMatch,Frequency of micturition,200843,Finding of frequency of urination
42497062,Clubbing of fingers,134746,Finger clubbing,exactMatch,,,,Clubbing of fingers,-1,
42497161,Abnormal microbiological findings in specimens from male genital organs,4171911,Abnormal microbiological finding in specimen from male genital organ,exactMatch,,,,Abnormal microbiological findings in specimens from male genital organs,-1,
42498185,Open wound of vagina and vulva,37310188,Open wound of female external genitalia,broadMatch,,,,Open wound of vagina and vulva,-1,
42498186,Open wound of other and unspecified external genital organs,4239520,Open wound of external genital organs,exactMatch,,,,Open wound of external genital organs,4239520,Open wound of external genital organs
42500798,Toxic effects of phenol and phenol homologues,4187822,Poisoning by phenol,exactMatch,40483089.0,Poisoning by phenolic,exactMatch,Toxic effects of phenol and phenol homologues,-1,
42500894,Other specified effects of reduced temperature,4086745,General effects of low temperature,exactMatch,37111520.0,Cold injury,exactMatch,effects of reduced temperature,-1,
42501284,Resistance to other single specified antibiotic,37017452,Drug resistance to antibacterial agent,exactMatch,,,,Resistance to antibiotic,-1,
42502994,Inhalation of gastric contents,254163,Pulmonary aspiration of gastric contents,exactMatch,,,,Inhalation of gastric contents,254163,Pulmonary aspiration of gastric contents
42503460,"Contact with venomous marine animals and plants, unspecified place",4155221,Exposure to poison of venomous animals and plants,broadMatch,,,,Contact with venomous marine animals and plants,-1,
42505118,"Surgical operation with formation of external stoma as the cause of abnormal reaction of the patient, or of later complication, without mention of misadventure at the time of the procedure",4123283,Disorder of stoma,broadMatch,,,,Abnormal reaction or later complication due to surgical operation with formation of external stoma,-1,
42505140,Sequelae of assault,4054807,Late effects of assault,exactMatch,,,,Sequelae of assault,-1,
42505276,Contact with and exposure to intestinal infectious diseases,37116462,Exposure to intestinal infectious disease,exactMatch,,,,Contact with and exposure to intestinal infectious diseases,-1,
42505348,Menstrual extraction,2004528,Menstrual extraction or regulation,exactMatch,,,,Menstrual extraction,2004528,Menstrual extraction or regulation
42505756,Family history of malignant neoplasm of breast,4179963,Family history of breast cancer,exactMatch,,,,Family history of malignant neoplasm of breast,4179963,Family history of breast cancer
42505891,Heart and lungs transplant status,42538118,Transplanted heart-lung present,exactMatch,42538118.0,Transplanted heart-lung present,broadMatch,Heart and lungs transplant status,-1,
42505980,"Hereditary disturbances in tooth structure, unspecified",606884,Hereditary disorder of tooth,exactMatch,,,,Hereditary disturbances in tooth structure,-1,
42616346,"Pyogenic arthritis, unspecified, Upper arm",76191,Disorder of upper arm,broadMatch,,,,"Pyogenic arthritis, upper arm",-1,
42617391,"Thoracogenic scoliosis, site unspecified",253009,Thoracogenic scoliosis,exactMatch,,,,Thoracogenic scoliosis,253009,Thoracogenic scoliosis
42617412,"Other forms of scoliosis, occipito-atlanto-axial region",4179319,Scoliosis of cervical spine,broadMatch,,,,"scoliosis, occipito-atlanto-axial region",-1,
